{
  "$schema": "./schema.json",
  "version": 1,
  "updated": "2026-08-07",
  "relationTypes": [
    "DEPENDS_ON",
    "CONFORMS_TO",
    "PROPOSES_TO",
    "RECORDS_IN",
    "PROJECTS_FROM",
    "EMBODIES",
    "DESCENDS_FROM",
    "DONATES_PATTERN_TO",
    "EXPERIMENTS_ON",
    "EXPORTS_TO"
  ],
  "projects": [
    {
      "id": "project0",
      "repository": "the-static-collective/project0",
      "kind": "constitutional-substrate",
      "status": "active",
      "role": "Canonical semantic identity and addressing",
      "owns": ["canonical encoding", "semantic addresses", "cross-language identity fixtures"],
      "nonAuthority": ["artifact custody", "domain admission", "human meaning"],
      "relations": []
    },
    {
      "id": "tranchnode",
      "repository": "the-static-collective/tranchnode",
      "kind": "constitutional-substrate",
      "status": "active",
      "role": "Immutable artifact custody, addressed graphs, projection closure, and fulfillment",
      "owns": ["immutable artifact storage", "provenance graph residue", "fulfillment substrate"],
      "nonAuthority": ["semantic identity rules", "domain admission", "projection truth"],
      "relations": [
        { "type": "CONFORMS_TO", "target": "project0", "note": "Uses Project0 canonical addressing rather than inventing a second identity law." },
        { "type": "DESCENDS_FROM", "target": "tranchnode-v1" }
      ]
    },
    {
      "id": "jubilee-authority-kit",
      "repository": "the-static-collective/jubilee-authority-kit",
      "kind": "shared-protocol",
      "status": "seed",
      "role": "Candidate reusable command, admission, refusal, receipt, and replay seam",
      "owns": ["framework-neutral transition contracts", "shared adversarial fixtures"],
      "nonAuthority": ["universal domain law", "canonical identity", "artifact storage", "automatic adoption"],
      "relations": [
        { "type": "CONFORMS_TO", "target": "project0", "note": "Receipt identity inherits the canonical addressing floor." }
      ]
    },
    {
      "id": "haunted-toaster",
      "repository": "the-static-collective/the-haunted-toaster",
      "kind": "domain-kernel",
      "status": "active",
      "role": "Lawful audiovisual score validation, resolution, preview, and render execution",
      "owns": ["VisualScore admission", "ResolvedTimeline", "render receipts"],
      "nonAuthority": ["unbounded creative proposal", "universal execution law"],
      "relations": []
    },
    {
      "id": "band-runtime",
      "repository": "the-static-collective/band-runtime",
      "kind": "domain-kernel",
      "status": "active",
      "role": "Encounter, admission, refusal, recognition, branching, and projection law",
      "owns": ["encounter event vocabulary", "artifact-write admission", "protected silence"],
      "nonAuthority": ["room user experience", "media playback", "universal human authorization"],
      "relations": []
    },
    {
      "id": "idea-grove",
      "repository": "the-static-collective/idea-grove",
      "kind": "domain-kernel",
      "status": "active",
      "role": "Human-governed proposal, harvest, and idea succession",
      "owns": ["grove vocabulary", "human harvest", "idea succession"],
      "nonAuthority": ["canonical addressing", "generic workflow law"],
      "relations": [
        { "type": "DESCENDS_FROM", "target": "jubilee-workspace" }
      ]
    },
    {
      "id": "full-measure",
      "repository": "the-static-collective/full-measure-world-layer",
      "kind": "domain-kernel",
      "status": "active",
      "role": "Participation, report, independent witness, harvest, and capacity law",
      "owns": ["participation lifecycle", "independent confirmation", "harvest semantics"],
      "nonAuthority": ["self-confirmation", "universal reputation"],
      "relations": []
    },
    {
      "id": "convergent-codec",
      "repository": "the-static-collective/convergent-codec",
      "kind": "research-kernel",
      "status": "active",
      "role": "Exact reconstruction competition and honest emitted-cost law",
      "owns": ["codec experiment law", "exact reconstruction scoring"],
      "nonAuthority": ["general artifact identity", "domain admission outside codec experiments"],
      "relations": []
    },
    {
      "id": "tranchnose",
      "repository": "the-static-collective/tranchNOSE",
      "kind": "research-kernel",
      "status": "active",
      "role": "Deterministic experiment receipts and exact replay",
      "owns": ["experiment receipt format", "named PRNG streams", "replay proof"],
      "nonAuthority": ["truth of a hypothesis", "target-system domain law"],
      "relations": []
    },
    {
      "id": "toaster-lab",
      "repository": "the-static-collective/toaster-lab",
      "kind": "proposal-discovery",
      "status": "active",
      "role": "Creative audiovisual proposal laboratory",
      "owns": ["CreativeProposal", "candidate exploration", "multimodal interpretation"],
      "nonAuthority": ["VisualScore validation", "canonical addressing", "render execution"],
      "relations": [
        { "type": "PROPOSES_TO", "target": "haunted-toaster" }
      ]
    },
    {
      "id": "toaster-oracle",
      "repository": "the-static-collective/toaster-oracle",
      "kind": "proposal-discovery",
      "status": "active",
      "role": "Feral upstream audiovisual generation and frontier exploration",
      "owns": ["wild candidate generation"],
      "nonAuthority": ["candidate admission", "execution", "canonical state"],
      "relations": [
        { "type": "PROPOSES_TO", "target": "toaster-lab" }
      ]
    },
    {
      "id": "seedforge",
      "repository": "the-static-collective/seedforge",
      "kind": "proposal-discovery",
      "status": "active",
      "role": "Major creative-proposal donor and active ancestor",
      "owns": ["creative seed exploration"],
      "nonAuthority": ["downstream admission", "canonical execution"],
      "relations": []
    },
    {
      "id": "seamforge",
      "repository": "the-static-collective/SEAMforge",
      "kind": "proposal-discovery",
      "status": "active",
      "role": "Architectural observation, seam discovery, and extraction proposals",
      "owns": ["contract-card observations", "typed architectural proposals"],
      "nonAuthority": ["declaring two systems equivalent", "merging domains", "canonical transition"],
      "relations": [
        { "type": "PROPOSES_TO", "target": "jubilee-authority-kit", "note": "Proposals require human adoption and proof in multiple domains." }
      ]
    },
    {
      "id": "founder-node",
      "repository": "the-static-collective/founder-node",
      "kind": "control-plane",
      "status": "dormant",
      "role": "Candidate compiler from founder intent into reviewable work proposals",
      "owns": ["intent compilation proposals"],
      "nonAuthority": ["repository execution", "human authorization", "domain admission"],
      "relations": []
    },
    {
      "id": "corpus-os",
      "repository": "the-static-collective/corpus-os",
      "kind": "embodiment",
      "status": "active",
      "role": "Evidence-preserving corpus navigation and first falsifiable downstream substrate proof",
      "owns": ["corpus admission policy", "exact evidence return", "corpus navigation"],
      "nonAuthority": ["source truth", "canonical addressing", "AI interpretation as fact"],
      "relations": [
        { "type": "DEPENDS_ON", "target": "tranchnode" },
        { "type": "CONFORMS_TO", "target": "project0" },
        { "type": "DESCENDS_FROM", "target": "corpus-os-local-intake" }
      ]
    },
    {
      "id": "groove-rooms",
      "repository": "the-static-collective/groove-rooms",
      "kind": "embodiment",
      "status": "active",
      "role": "Inhabitable collaborative listening room",
      "owns": ["rooms and invites", "media experience", "voluntary playback coordination"],
      "nonAuthority": ["encounter law", "mix as canonical truth"],
      "relations": [
        { "type": "EMBODIES", "target": "band-runtime" }
      ]
    },
    {
      "id": "formation-trace",
      "repository": "the-static-collective/formation-trace",
      "kind": "embodiment",
      "status": "active",
      "role": "Private formation instrument with explicit offered-export boundaries",
      "owns": ["private formation trace", "local mutation and privacy policy"],
      "nonAuthority": ["automatic disclosure", "shared-runtime authority"],
      "relations": []
    },
    {
      "id": "the-autodisco",
      "repository": "the-static-collective/the-autodisco",
      "kind": "embodiment",
      "status": "active",
      "role": "Archive, radio, lineage braid, and collective-memory surface",
      "owns": ["autodiscography experience", "collective archive projection"],
      "nonAuthority": ["source-artifact identity", "lineage invention"],
      "relations": [
        { "type": "DESCENDS_FROM", "target": "autodisco-v20" }
      ]
    },
    {
      "id": "circle",
      "repository": "the-static-collective/circle",
      "kind": "embodiment",
      "status": "active",
      "role": "Broad communal product proving ground",
      "owns": ["circle product experience"],
      "nonAuthority": ["shared constitutional substrate"],
      "relations": [
        { "type": "DESCENDS_FROM", "target": "jubilee-campfire" }
      ]
    },
    {
      "id": "gramfork",
      "repository": "the-static-collective/gramfork",
      "kind": "embodiment",
      "status": "active",
      "role": "Hardened mutual-aid product proof",
      "owns": ["mutual-aid circles", "needs and contributions", "verified stages"],
      "nonAuthority": ["generic admission law", "universal trust"],
      "relations": [
        { "type": "DESCENDS_FROM", "target": "bananagram-gram-to-fork" }
      ]
    },
    {
      "id": "recoreturn",
      "repository": "the-static-collective/reCOreturn",
      "kind": "embodiment",
      "status": "active",